Item Title,Publication Title,Book Series Title,Journal Volume,Journal Issue,Item DOI,Authors,Publication Year,URL,Content Type
"Learning Technology for Education Challenges","Communications in Computer and Information Science","","","","10.1007/978-3-030-81350-5","Lorna UdenDario Liberona","2021","http://link.springer.com/book/10.1007/978-3-030-81350-5","Book"
"High-Confidence Compositional Reliability Assessment of SOA-Based Systems Using Machine Learning Techniques","Machine Learning in Cyber Trust","","","","10.1007/978-0-387-88735-7_11","Venkata U. B. ChallagullaFarokh B. BastaniI-Ling Yen","2009","http://link.springer.com/chapter/10.1007/978-0-387-88735-7_11","Chapter"
"Concise Guide to Software Engineering","Undergraduate Topics in Computer Science","","","","10.1007/978-3-319-57750-0","Gerard O'Regan","2017","http://link.springer.com/book/10.1007/978-3-319-57750-0","Book"
"Human-Computer Interaction. Theory, Methods and Tools","Lecture Notes in Computer Science","","","","10.1007/978-3-030-78462-1","Masaaki Kurosu","2021","http://link.springer.com/book/10.1007/978-3-030-78462-1","Book"
"Mobile Edge Computing","","","","","10.1007/978-3-030-69893-5","Dr. Anwesha MukherjeeProf. Dr. Debashis DeProf. Dr. Soumya K. GhoshProf. Dr. Rajkumar Buyya","2021","http://link.springer.com/book/10.1007/978-3-030-69893-5","Book"
"Change-Enabled Software Systems","Software-Intensive Systems and New Computing Paradigms","","","","10.1007/978-3-540-89437-7_3","Oscar NierstraszMarcus DenkerTudor GîrbaAdrian LienhardDavid Röthlisberger","2008","http://link.springer.com/chapter/10.1007/978-3-540-89437-7_3","Chapter"
"A state of the art review of intelligent scheduling","Artificial Intelligence Review","","53","1","10.1007/s10462-018-9667-6","Mohammad Hossein Fazel ZarandiAli Akbar Sadat AslShahabeddin SotudianOscar Castillo","2020","http://link.springer.com/article/10.1007/s10462-018-9667-6","Article"
"Emerging topics in mining software repositories","Progress in Artificial Intelligence","","7","3","10.1007/s13748-018-0147-7","Diego Güemes-PeñaCarlos López-NozalRaúl Marticorena-SánchezJesús Maudes-Raedo","2018","http://link.springer.com/article/10.1007/s13748-018-0147-7","Article"
"Analyzing Privacy Risk in Human Mobility Data","Software Technologies: Applications and Foundations","","","","10.1007/978-3-030-04771-9_10","Roberto PellungriniLuca PappalardoFrancesca PratesiAnna Monreale","2018","http://link.springer.com/chapter/10.1007/978-3-030-04771-9_10","Chapter"
"Introduction to Part III: Markers to mHealth Predictors","Mobile Health","","","","10.1007/978-3-319-51394-2_17","James M. RehgSusan A. MurphySantosh Kumar","2017","http://link.springer.com/chapter/10.1007/978-3-319-51394-2_17","Chapter"
"Advances of Science and Technology","Lecture Notes of the Institute for Computer Sciences, Social Informatics and Telecommunications Engineering","","","","10.1007/978-3-030-80621-7","Mulugeta Admasu DeleleMekuanint Agegnehu BitewAbebech Abera BeyeneSolomon Workneh FantaAddisu Negash Ali","2021","http://link.springer.com/book/10.1007/978-3-030-80621-7","Book"
"Runtime Verification","Lecture Notes in Computer Science","","","","10.1007/978-3-030-88494-9","Ph.D. Lu FengDr. Dana Fisman","2021","http://link.springer.com/book/10.1007/978-3-030-88494-9","Book"
"Computational Science – ICCS 2021","Lecture Notes in Computer Science","","","","10.1007/978-3-030-77970-2","Prof. Maciej PaszynskiProf. Dr. Dieter KranzlmüllerDr. Valeria V. KrzhizhanovskayaProf. Jack J. DongarraProf. Dr. Peter M.A. Sloot","2021","http://link.springer.com/book/10.1007/978-3-030-77970-2","Book"
"The Robotic Process Automation Handbook","","","","","10.1007/978-1-4842-5729-6","Tom Taulli","2020","http://link.springer.com/book/10.1007/978-1-4842-5729-6","Book"
"A framework for Model-Driven Engineering of resilient software-controlled systems","Computing","","103","4","10.1007/s00607-020-00841-6","Jacopo ParriFulvio PataraSamuele SampietroEnrico Vicario","2021","http://link.springer.com/article/10.1007/s00607-020-00841-6","Article"
"HCI Requirements for Transparency and Accountability Tools for Cloud Service Chains","Accountability and Security in the Cloud","","","","10.1007/978-3-319-17199-9_4","Simone Fischer-HübnerJohn Sören PetterssonJulio Angulo","2015","http://link.springer.com/chapter/10.1007/978-3-319-17199-9_4","Chapter"
"Formal specification and verification of the pGVT algorithm","FME'96: Industrial Benefit and Advances in Formal Methods","","","","10.1007/3-540-60973-3_99","Balakrishnan KannikeswaranRadharamanan RadhakrishnanPeter FreyPerry AlexanderPhilip A. Wilsey","1996","http://link.springer.com/chapter/10.1007/3-540-60973-3_99","Chapter"
"Practical Security Aspects of the Internet of Things","Cybersecurity for Industry 4.0","","","","10.1007/978-3-319-50660-9_9","Jörn MehnenHongmei HeStefano TedeschiNikolaos Tapoglou","2017","http://link.springer.com/chapter/10.1007/978-3-319-50660-9_9","Chapter"
"REM in Agile Projects","Requirements Engineering and Management for Software Development Projects","","","","10.1007/978-1-4614-5377-2_15","Murali Chemuturi","2013","http://link.springer.com/chapter/10.1007/978-1-4614-5377-2_15","Chapter"
"Modeling Opportunities in mHealth Cyber-Physical Systems","Mobile Health","","","","10.1007/978-3-319-51394-2_23","Wendy NilsenEmre ErtinEric B. HeklerSantosh KumarInsup LeeRahul MangharamMisha PavelJames M. RehgWilliam RileyDaniel E. RiveraDonna Spruijt-Metz","2017","http://link.springer.com/chapter/10.1007/978-3-319-51394-2_23","Chapter"
"Enabling a Pervasive Approach for Intelligent Decision Support in Critical Health Care","ENTERprise Information Systems","","","","10.1007/978-3-642-24352-3_25","Carlos Filipe PortelaManuel Filipe SantosÁlvaro SilvaJosé MachadoAntónio Abelha","2011","http://link.springer.com/chapter/10.1007/978-3-642-24352-3_25","Chapter"
"Achieving Dependability in Service-Oriented Systems","Dependable and Historic Computing","","","","10.1007/978-3-642-24541-1_37","Jie Xu","2011","http://link.springer.com/chapter/10.1007/978-3-642-24541-1_37","Chapter"
"Establishing Operational Models for Dynamic Compilation in a Simulation Platform","Nature of Computation and Communication","","","","10.1007/978-3-319-15392-6_12","Nghi Quang HuynhTram Huynh VoHiep Xuan HuynhAlexis Drogoul","2015","http://link.springer.com/chapter/10.1007/978-3-319-15392-6_12","Chapter"
"Data Assurance in Opaque Computations","Advances in Computer Games","","","","10.1007/978-3-642-12993-3_20","Joe HurdGuy Haworth","2010","http://link.springer.com/chapter/10.1007/978-3-642-12993-3_20","Chapter"
"Smart Connected World","","","","","10.1007/978-3-030-76387-9","Dr. Sarika JainSan Murugesan","2021","http://link.springer.com/book/10.1007/978-3-030-76387-9","Book"
"Practical Data Science with Python 3","","","","","10.1007/978-1-4842-4859-1","Ervin Varga","2019","http://link.springer.com/book/10.1007/978-1-4842-4859-1","Book"
"Data Management Technologies and Applications","Communications in Computer and Information Science","","","","10.1007/978-3-030-83014-4","Slimane HammoudiChristoph QuixJorge Bernardino","2021","http://link.springer.com/book/10.1007/978-3-030-83014-4","Book"
"A Learning Roadmap for Digital Lean Manufacturing","Advances in Production Management Systems. Towards Smart and Digital Manufacturing","","","","10.1007/978-3-030-57997-5_48","Anja Bottinga SolheimDaryl John Powell","2020","http://link.springer.com/chapter/10.1007/978-3-030-57997-5_48","Chapter"
"A Sanctuary for Mobile Agents","Secure Internet Programming","","","","10.1007/3-540-48749-2_12","Bennet S. Yee","1999","http://link.springer.com/chapter/10.1007/3-540-48749-2_12","Chapter"
"Impacts of TEI on SMEs","Impacts and Risk Assessment of Technology for Internet Security","","","","10.1007/0-387-26334-9_2","","2005","http://link.springer.com/chapter/10.1007/0-387-26334-9_2","Chapter"
"DRASTIC: A run-time architecture for evolving, distributed, persistent systems","ECOOP'97 — Object-Oriented Programming","","","","10.1007/BFb0053382","Huw EvansPeter Dickman","1997","http://link.springer.com/chapter/10.1007/BFb0053382","Chapter"
"Research Topics in Spoken Dialogue Technology","Spoken Dialogue Technology","","","","10.1007/978-0-85729-414-2_14","Michael F. McTear","2004","http://link.springer.com/chapter/10.1007/978-0-85729-414-2_14","Chapter"
"Predictable Parallel Performance: The BSP Model","Models for Parallel and Distributed Computation","","","","10.1007/978-1-4757-3609-0_4","D. B. Skillicorn","2002","http://link.springer.com/chapter/10.1007/978-1-4757-3609-0_4","Chapter"
"Enhancing Regional Digital Preparedness on Natural Hazards to Safeguard Business Resilience in the Asia-Pacific","Information Technology in Disaster Risk Reduction","","","","10.1007/978-3-319-68486-4_14","Yanling LeeKenji WatanabeWei-Sen Li","2017","http://link.springer.com/chapter/10.1007/978-3-319-68486-4_14","Chapter"
"New Statistics for Design Researchers","Human–Computer Interaction Series","","","","10.1007/978-3-030-46380-9","Dr. Martin Schmettow","2021","http://link.springer.com/book/10.1007/978-3-030-46380-9","Book"
"Early Warning System Potential for Single Sourcing Risk Mitigation","Collaborative Systems for Smart Networked Environments","","","","10.1007/978-3-662-44745-1_60","Patricia FranconettiAngel Ortiz","2014","http://link.springer.com/chapter/10.1007/978-3-662-44745-1_60","Chapter"
"Creating Components",".NET Development for Java Programmers","","","","10.1007/978-1-4302-1106-8_10","Paul Gibbons","2002","http://link.springer.com/chapter/10.1007/978-1-4302-1106-8_10","Chapter"
"Digital Manufacturing/Industry 4.0","Guide to Computing Fundamentals in Cyber-Physical Systems","","","","10.1007/978-3-319-25178-3_7","Dietmar P. F. Möller","2016","http://link.springer.com/chapter/10.1007/978-3-319-25178-3_7","Chapter"
"Case Studies: Synthesis of ADDM Algorithms for Real-World Systems","Algorithm Design for Networked Information Technology Systems","","","","10.1007/0-387-21616-2_3","","2004","http://link.springer.com/chapter/10.1007/0-387-21616-2_3","Chapter"
"A Process Framework Combining Safety and Security in Practice","Systems, Software and Services Process Improvement","","","","10.1007/978-3-319-97925-0_14","Fergal McCafferyÖzden Özcan-TopCeara TreacyPangkaj PaulJohn LoaneJennifer CrillyArthur Mc Mahon","2018","http://link.springer.com/chapter/10.1007/978-3-319-97925-0_14","Chapter"
"Protecting Personal Information in Cloud Computing","On the Move to Meaningful Internet Systems: OTM 2012","","","","10.1007/978-3-642-33615-7_3","Miranda MowbraySiani Pearson","2012","http://link.springer.com/chapter/10.1007/978-3-642-33615-7_3","Chapter"
"Teaching and Computers","Cooperative Computer-Aided Authoring and Learning","","","","10.1007/978-1-4615-2253-9_2","Max Mühlhäuser","1995","http://link.springer.com/chapter/10.1007/978-1-4615-2253-9_2","Chapter"
"The Anticipatory Approach: Definitions and Taxonomies","The Challenge of Anticipation","","","","10.1007/978-3-540-87702-8_2","Giovanni PezzuloMartin V. ButzCristiano Castelfranchi","2008","http://link.springer.com/chapter/10.1007/978-3-540-87702-8_2","Chapter"
"Scheduling in overlaid star all-photonic networks with large propagation delays","Photonic Network Communications","","17","2","10.1007/s11107-008-0150-1","N. SaberiM. J. Coates","2008","http://link.springer.com/article/10.1007/s11107-008-0150-1","Article"
"Bringing Interactive Process Mining to Health Professionals: Interactive Data Rodeos","Interactive Process Mining in Healthcare","","","","10.1007/978-3-030-53993-1_8","Carlos Fernandez-Llatas","2021","http://link.springer.com/chapter/10.1007/978-3-030-53993-1_8","Chapter"
"Integration of Risk and Resilience into Policy","Resilience and Risk","","","","10.1007/978-94-024-1123-2_12","Raymond NyerCharles BaubionBérangère BasinAdeline DamicisSonia MaraisseMathieu MorelEmmanuel Vullierme","2017","http://link.springer.com/chapter/10.1007/978-94-024-1123-2_12","Chapter"
"Simplify and Rationalize IT and Security","Rational Cybersecurity for Business","","","","10.1007/978-1-4842-5952-8_7","Dan Blum","2020","http://link.springer.com/chapter/10.1007/978-1-4842-5952-8_7","Chapter"
"Tailoring Interface for Spanish Language: A Case Study with CHICA System","Human Centered Design","","","","10.1007/978-3-642-02806-9_46","Vibha AnandPaul G. BiondichAaron E. CarrollStephen M. Downs","2009","http://link.springer.com/chapter/10.1007/978-3-642-02806-9_46","Chapter"
"Maintenance Management Characterization: Process, Framework and Supporting Pillars","The Maintenance Management Framework","","","","10.1007/978-1-84628-821-0_2","","2007","http://link.springer.com/chapter/10.1007/978-1-84628-821-0_2","Chapter"
"Towards a Generic Resilience Management, Quantification and Development Process: General Definitions, Requirements, Methods, Techniques and Measures, and Case Studies","Resilience and Risk","","","","10.1007/978-94-024-1123-2_2","Ivo HäringGiovanni SansaviniEmanuele BelliniNick MartynTatyana KovalenkoMaksim KitsakGeorg VogelbacherKatharina RossUlrich BergerhausenKash BarkerIgor Linkov","2017","http://link.springer.com/chapter/10.1007/978-94-024-1123-2_2","Chapter"
"Dimensions of Cybersecurity Risk Management","Advances in Cybersecurity Management","","","","10.1007/978-3-030-71381-2_17","Kendall E. NygardAakanksha RastogiMostofa AhsanRashmi Satyal","2021","http://link.springer.com/chapter/10.1007/978-3-030-71381-2_17","Chapter"
"Engineering Artificially Intelligent Systems","Lecture Notes in Computer Science","","","","10.1007/978-3-030-89385-9","William F. LawlessProf. James LlinasDonald A. SofgeRanjeev Mittu","2021","http://link.springer.com/book/10.1007/978-3-030-89385-9","Book"
"A Survival Analysis of Source Files Modified by New Developers","Product-Focused Software Process Improvement","","","","10.1007/978-3-319-69926-4_7","Hirohisa AmanSousuke AmasakiTomoyuki YokogawaMinoru Kawahara","2017","http://link.springer.com/chapter/10.1007/978-3-319-69926-4_7","Chapter"
"Estimating the number of remaining links in traceability recovery","Empirical Software Engineering","","22","3","10.1007/s10664-016-9460-6","Davide FalessiMassimiliano Di PentaGerardo CanforaGiovanni Cantone","2017","http://link.springer.com/article/10.1007/s10664-016-9460-6","Article"
"Getting Started with Azure Security Center","Cyber Security on Azure","","","","10.1007/978-1-4842-2740-4_3","Marshall Copeland","2017","http://link.springer.com/chapter/10.1007/978-1-4842-2740-4_3","Chapter"
"IT Enabled Risk Management for Taxation and Customs: The Case of AEO Assessment in the Netherlands","Electronic Government","","","","10.1007/978-3-642-03516-6_32","Jianwei LiuYao-Hua TanJoris Hulstijn","2009","http://link.springer.com/chapter/10.1007/978-3-642-03516-6_32","Chapter"
"Sample Privileged Access Management Use Cases","Privileged Attack Vectors","","","","10.1007/978-1-4842-5914-6_23","Morey J. Haber","2020","http://link.springer.com/chapter/10.1007/978-1-4842-5914-6_23","Chapter"
"Safety Assurance of Open Adaptive Systems – A Survey","Models@run.time","","","","10.1007/978-3-319-08915-7_11","Mario TrappDaniel Schneider","2014","http://link.springer.com/chapter/10.1007/978-3-319-08915-7_11","Chapter"
"Using Modeling and Simulation as a Framework for Testing New Solutions Devoted to Securing Global Flows of Goods and People","Harbour Protection Through Data Fusion Technologies","","","","10.1007/978-1-4020-8883-4_25","Agostino BruzzoneChiara Briano","2009","http://link.springer.com/chapter/10.1007/978-1-4020-8883-4_25","Chapter"
"Current State of Security","Beginning Security with Microsoft Technologies","","","","10.1007/978-1-4842-4853-9_1","Vasantha Lakshmi","2019","http://link.springer.com/chapter/10.1007/978-1-4842-4853-9_1","Chapter"
"A Survey on the Moving Target Defense Strategies: An Architectural Perspective","Journal of Computer Science and Technology","","34","1","10.1007/s11390-019-1906-z","Jianjun ZhengAkbar Siami Namin","2019","http://link.springer.com/article/10.1007/s11390-019-1906-z","Article"
"Discrete Event Complex Systems: Scheduling with Neural Networks","Dealing with Complexity","","","","10.1007/978-1-4471-1523-6_11","Mirek Kárný Csc, DrScKevin Warwick BSc, PhD, DSc, DrScVera Kůrková PhD","1998","http://link.springer.com/chapter/10.1007/978-1-4471-1523-6_11","Chapter"
"A Conceptual Framework for Stage Configuration","Advances in Production Management Systems. Production Management for Data-Driven, Intelligent, Collaborative, and Sustainable Manufacturing","","","","10.1007/978-3-319-99704-9_13","Bjørn ChristensenThomas D. BrunoeKjeld Nielsen","2018","http://link.springer.com/chapter/10.1007/978-3-319-99704-9_13","Chapter"
"Workflow scheduling in cloud: a survey","The Journal of Supercomputing","","71","9","10.1007/s11227-015-1438-4","Fuhui WuQingbo WuYusong Tan","2015","http://link.springer.com/article/10.1007/s11227-015-1438-4","Article"
"Achieving Agility in IT Project Portfolios – A Systematic Literature Review","Lean and Agile Software Development","","","","10.1007/978-3-030-67084-9_5","Joseph Puthenpurackal ChakkoTim HuyghSteven De Haes","2021","http://link.springer.com/chapter/10.1007/978-3-030-67084-9_5","Chapter"
"Information and Knowledge Economies","Organizational Semiotics","","","","10.1007/978-0-387-35611-2_2","Daniel O’ConnorRob ShieldsSuzan IlcanEdwina Taborsky","2002","http://link.springer.com/chapter/10.1007/978-0-387-35611-2_2","Chapter"
"Using Classification Methods to Reinforce the Impact of Social Factors on Software Success","Computational Science and Its Applications – ICCSA 2016","","","","10.1007/978-3-319-42092-9_15","Eudisley AnjosJansepetrus BrasileiroDanielle SilvaMário Zenha-Rela","2016","http://link.springer.com/chapter/10.1007/978-3-319-42092-9_15","Chapter"
"Versionized process based on non-volatile random-access memory for fine-grained fault tolerance","Frontiers of Information Technology & Electronic Engineering","","19","2","10.1631/FITEE.1601477","Wen-zhe ZhangKai LuXiao-ping Wang","2018","http://link.springer.com/article/10.1631/FITEE.1601477","Article"
"Introducing Policy-Driven Governance and Service Level Failure Mitigation in Cloud Service Brokers: Challenges Ahead","Service-Oriented Computing – ICSOC 2013 Workshops","","","","10.1007/978-3-319-06859-6_16","Konstantinos BratanisDimitrios Kourtesis","2014","http://link.springer.com/chapter/10.1007/978-3-319-06859-6_16","Chapter"
"Overview of Agile Software Development","Agile Software Development","","","","10.1007/978-3-540-70832-2_3","Dr. Thomas StoberUwe Hansmann","2010","http://link.springer.com/chapter/10.1007/978-3-540-70832-2_3","Chapter"
"Information Systems Management","Information Systems Development","","","","10.1007/978-1-349-14931-5_32","Paul Beynon-Davies","1998","http://link.springer.com/chapter/10.1007/978-1-349-14931-5_32","Chapter"
"Distributed Applications and Interoperable Systems","Lecture Notes in Computer Science","","","","10.1007/978-3-030-78198-9","Miguel MatosFabíola Greve","2021","http://link.springer.com/book/10.1007/978-3-030-78198-9","Book"
"Student and expert modelling for simulation-based training: A cost effective framework","Intelligent Tutoring Systems","","","","10.1007/3-540-61327-7_161","Kalina YacefLeila Alem","1996","http://link.springer.com/chapter/10.1007/3-540-61327-7_161","Chapter"
"An Exploratory Study of Risk Factors for Implementing Service-Oriented IS Projects","Designing E-Business Systems. Markets, Services, and Networks","","","","10.1007/978-3-642-01256-3_8","Hsin-Lu ChangChia-Pei Lue","2009","http://link.springer.com/chapter/10.1007/978-3-642-01256-3_8","Chapter"
"Safety Case Development - a Practical Guide","Developments in Risk-based Approaches to Safety","","","","10.1007/1-84628-447-3_6","Derek FowlerDr Bernd Tiemeyer","2006","http://link.springer.com/chapter/10.1007/1-84628-447-3_6","Chapter"
"Quality-related locally weighted soft sensing for non-stationary processes by a supervised Bayesian network with latent variables","Frontiers of Information Technology & Electronic Engineering","","22","9","10.1631/FITEE.2000426","Yuxue Xu 徐玉雪Yun Wang 王云Tianhong Yan 严天宏Yuchen He 何雨辰Jun Wang 王君De Gu 顾德Haiping Du 杜海平Weihua Li 李卫华","2021","http://link.springer.com/article/10.1631/FITEE.2000426","Article"
"Internet Computing","","","","","10.1007/978-3-030-34957-8","Prof. Dr. Ali Sunyaev","2020","http://link.springer.com/book/10.1007/978-3-030-34957-8","Book"
"Traffic Management for Cloud Federation","Autonomous Control for a Reliable Internet of Services","","","","10.1007/978-3-319-90415-3_11","Wojciech BurakowskiAndrzej BebenHans van den BergJoost W. BosmanGerhard HasslingerAttila KerteszSteven LatreRob van der MeiTamas PflanznerPatrick Gwydion PoullieMaciej SosnowskiBart SpinnewynBurkhard Stiller","2018","http://link.springer.com/chapter/10.1007/978-3-319-90415-3_11","Chapter"
"A Survey on Spot Pricing in Cloud Computing","Journal of Network and Systems Management","","26","4","10.1007/s10922-017-9444-x","Dinesh KumarGaurav BaranwalZahid RazaDeo Prakash Vidyarthi","2018","http://link.springer.com/article/10.1007/s10922-017-9444-x","Article"
"Galileo: A Simulation Tool for Leo Satellite Constellations","Modeling and Simulation Environment for Satellite and Terrestrial Communications Networks","","","","10.1007/978-1-4615-0863-2_11","Laurent FranckFrancesco Potortì","2002","http://link.springer.com/chapter/10.1007/978-1-4615-0863-2_11","Chapter"
"Errors and error recovery","Human error and system design and management","","","","10.1007/BFb0110452","Tjerk W. van der SchaafL. Kanse","2000","http://link.springer.com/chapter/10.1007/BFb0110452","Chapter"
"The Future(s) of Social Machines: The Research Agenda","The Theory and Practice of Social Machines","","","","10.1007/978-3-030-10889-2_5","Nigel ShadboltKieron O’HaraDavid De RoureWendy Hall","2019","http://link.springer.com/chapter/10.1007/978-3-030-10889-2_5","Chapter"
"Particle filtering-based methods for time to failure estimation with a real-world prognostic application","Applied Intelligence","","48","8","10.1007/s10489-017-1083-0","Chunsheng YangQingfeng LouJie LiuYubin YangQiangqiang Cheng","2018","http://link.springer.com/article/10.1007/s10489-017-1083-0","Article"
"Dependability as Ordinary Action","Computer Safety, Reliability and Security","","","","10.1007/3-540-45732-1_5","Alexander VoßRoger SlackRob ProcterRobin WilliamsMark HartswoodMark Rouncefield","2002","http://link.springer.com/chapter/10.1007/3-540-45732-1_5","Chapter"
"Security and Governance","Cloud Standards","","","","10.1007/978-1-4302-4111-9_4","Marvin Waschke","2012","http://link.springer.com/chapter/10.1007/978-1-4302-4111-9_4","Chapter"
"A Reference Architecture for IoT-Enabled Dynamic Planning in Smart Logistics","Advanced Information Systems Engineering","","","","10.1007/978-3-030-79382-1_33","Martijn KootMaria-Eugenia IacobMartijn R. K. Mes","2021","http://link.springer.com/chapter/10.1007/978-3-030-79382-1_33","Chapter"
"Smart Car Space: An Application","SmartShadow: Models and Methods for Pervasive Computing","","","","10.1007/978-3-642-36382-5_6","Zhaohui WuGang Pan","2013","http://link.springer.com/chapter/10.1007/978-3-642-36382-5_6","Chapter"
"A Taxonomy of Side Channel Attacks on Critical Infrastructures and Relevant Systems","Critical Infrastructure Security and Resilience","","","","10.1007/978-3-030-00024-0_15","Nick TsalisEfstratios VasilellisDespina MentzeliotiTheodore Apostolopoulos","2019","http://link.springer.com/chapter/10.1007/978-3-030-00024-0_15","Chapter"
"Threat Poker: Gamification of Secure Agile","Information Security Education. Information Security in Action","","","","10.1007/978-3-030-59291-2_10","Audun JøsangViktoria StrayHanne Rygge","2020","http://link.springer.com/chapter/10.1007/978-3-030-59291-2_10","Chapter"
"Assessment of Agile Maturity Models: A Multiple Case Study","Software Process Improvement and Capability Determination","","","","10.1007/978-3-642-38833-0_12","Ozden Ozcan-TopOnur Demirörs","2013","http://link.springer.com/chapter/10.1007/978-3-642-38833-0_12","Chapter"
"Relation Between Abductive and Inductive Types of Nursing Risk Management","New Frontiers in Artificial Intelligence","","","","10.1007/978-3-540-69902-6_33","Akinori AbeHiromi Itoh OzakuNoriaki KuwaharaKiyoshi Kogure","2007","http://link.springer.com/chapter/10.1007/978-3-540-69902-6_33","Chapter"
"Architecture for Digital Spare-Parts Library: Use of Additive Layer Manufacturing in the Petroleum Industry","Advances in Production Management Systems. Production Management for the Factory of the Future","","","","10.1007/978-3-030-30000-5_66","R. M. Chandima RatnayakeArvind KeprateRoman Wdowik","2019","http://link.springer.com/chapter/10.1007/978-3-030-30000-5_66","Chapter"
"Understanding and Supporting Dependability as Ordinary Action","Trust in Technology: A Socio-Technical Perspective","","","","10.1007/1-4020-4258-2_9","Alexander VoßRob ProcterRoger SlackMark HartswoodMark Rouncefield","2006","http://link.springer.com/chapter/10.1007/1-4020-4258-2_9","Chapter"
"Introduction to Scrum and Agile Concepts","Agile Project Management using Team Foundation Server 2015","","","","10.1007/978-1-4842-1870-9_3","Joachim Rossberg","2016","http://link.springer.com/chapter/10.1007/978-1-4842-1870-9_3","Chapter"
"Development Processes and Frameworks","Beginning Application Lifecycle Management","","","","10.1007/978-1-4302-5813-1_3","Joachim Rossberg","2014","http://link.springer.com/chapter/10.1007/978-1-4302-5813-1_3","Chapter"
"Aliasing in Object Oriented Systems","Object-Oriented Technology ECOOP’99 Workshop Reader","","","","10.1007/3-540-46589-8_8","James NobleJan VitekDoug LeaPaulo Sergio Almeida","1999","http://link.springer.com/chapter/10.1007/3-540-46589-8_8","Chapter"
